Ingredienti,NOAEL,Contesto,Link PDF
"1,10-Decanediol","['200 mg/kg', '400 mg/kg', '1000 mg/kg', '1000 mg/kg', '15 mg/kg', '150 mg/kg', '200 mg/kg', '1000 mg/kg', '400 mg/kg', '150 mg/kg', '23 mg/kg', '1000 mg/kg', '100 mg/kg', '1000 mg/kg', '400 mg', '1000 mg/kg', '1000 mg/kg', '1000 mg/kg', '1000 mg/kg', '1000 mg/kg', '1000 mg', '100 mg/kg', '1000 mg/kg', '150 mg/kg', '1000 mg/kg', '150 mg/kg', '1000 mg/kg', '200 mg/kg', '15 mg/kg', '600 mg/kg', '1000 mg/kg', '100 mg/kg', '1000 mg/kg', '150 mg/kg', '1000 mg']","['clinical chemistry samples were collected at study termination; necropsy performed 200 mg/kg /day for males and females; dose dependent toxic central nervous', 'by gavage as indicated; blood and urine samples were collected 400 mg/kg /day (males) and NOAEL of 1000 mg/kg/ day (females); no', 'and urine samples were collectedNOAEL of 400 mg/kg/day (males) and 1000 mg/kg / day (females); no mortality; treatment-related decrease with1000 mg/kg/day (males', 'daily by gavage as indicated; blood samples collected; necropsy performed 1000 mg/kg /day (males and females); NOEL of 15 mg/kg/day (males and', 'by gavage as indicated;blood and urine samples collected; necropsy performed 15 mg/kg /day (males) and NOAEL of 150 mg/kg/day (females); treatment-related deaths', 'urine samples collected; necropsy performedNOAEL of 15 mg/kg/day (males) and 150 mg/kg /day (females); treatment-related deaths of 3 males (1000 mg/kg/day) and', 'animals), and bladder abnormalities (400 and 800 mg/kg/day); a no-observed-adverse-effect-level( 200 mg/kg /day was reported. 13The results of testing Hexanediol in rats', 'a y sw e r ereported to be unremarkable. 20A 1000 mg/kg / day was reported for Butyl Ethyl Propanediol in a', 'at 10 mL/ kg and 2 deaths at 5 mL/kg.12 400 mg/kg /day (males) and 1000 mg/kg/day(females); a treatment-relate d decrease (in', 'were decreased liver enzymes and inorganic phosphate (at 1000 mg/kg/day).20 150 mg/kg /day (females) and 15 mg/kg/day(males) were reported for Butyl Ethyl', 'time) evaluating 1 ,4-Butanediol, a NOAEC of 500 mg/L (or 23 mg/kg /day) and a lowest-observed-adverse-effect-concentration (LOAEC) of 1500 mg/L (or lowest-observed-ad', 'on days 6 through 15 of gestationMaternal and fetal toxicity 1000 mg/kg /day; no maternal toxiceffects from treatment (fertility rate was 91%', 'gavage during days 6 through 15 of gestationMaternal and developmental 100 mg/kg /day; maternal anddevelopmental LOAEL of 300 mg/kg/ day ; no', 'day 4;animals killed at study conclusion and necropsy performedParental (female) 1000 mg/kg / day; parental (male) NOAEL of 400 mg/ kg/day; offspring', 'necropsy performedParental (female) NOAEL of 1000 mg/kg/ day; parental (male) 400 mg / kg/day; offspring (male/female) NOAELof 1000 mg/kg/day; male parents (1000', 'day; parental (male) NOAEL of 400 mg/ kg/day; offspring (male/female) 1000 mg/kg /day; male parents (1000 mg/kg/day) showed treatment-related (stat. sig) decrease', 'of gestation females were killed and necropsies performedMaternal and developmental 1000 mg/kg /day; no maternal mortalities or clinical signs; maternal body weight', 'at studytermination uterus, ovaries, and offspring were examinedMaternal and developmental 1000 mg/kg /day; no maternal toxic or embryotoxic effects were observed15 Methylpropanediol', 'were dosed by gavage (no further details provided)Maternal and neonatal 1000 mg/kg /day115 Methylpropanediol Rat, Wistar Females Up to 1000 mg/kg, negative', 'of gestation (no furtherdetails provided)Maternal toxicity, fetotoxicity, and teratogenic effects 1000 mg/kg /day; intrauterine growth and survival was not affected by treatment,', 'of gestation) or fetal toxiceffects were observed (maternal and fetal 1000 mg / kg/day). 12In a mouse study evaluating 1,4-Butanediol at up', 'on days 6 - 15 of gestation), amaternal and developmental 100 mg/kg /dayand a LOAEL of 300 mg/kg/day were reported; maternalcentral nervous', 'parental reproductive parameters were changed bytreatment. 13,22A maternal and developmental 1000 mg/kg /day was reported in animal studies on Hex- anediol (rats', '1000 mg/kg/day on days 6 - 19 ofgestation), a maternal 150 mg/kg /day (reducedactivity, staggering, limb dragging, slow respiration, andreduced food consumption/', 'consumption/ body weight at 1000 mg/kg dose) and a developmental 1000 mg/kg /day were reported. 17 Genotoxicity Provided below is a summary', 'gestation; animals were killed on gestation day 20; necropsy performedMaternal 150 mg/kg /day; Developmental NOAEL of 1000 mg/kg/ day; maternal clinical signs', 'gestation day 20; necropsy performedMaternal NOAEL of 150 mg/kg/day; Developmental 1000 mg/kg / day; maternal clinical signs included subdued behavior, reduced activity,', 'for Methylpropanediol.122S International Journal of Toxicology 43(Supplement 2)Reported NOELs and 200 mg/kg /day 1,4-Butanediol(∼42 days), 500 mg/kg/day 1,4-Butanediol in females and 50', '5.2 mg/L only); a 1.1 mg/L NOAEC was reported. The 15 mg/kg /day and 150 mg/kg/day Butyl Ethyl Pro-panediol (90 days) in', 'male and female rats, respectively. In 90- day studies, a 600 mg/kg /day was reported for Methylpropanediol and NOAELs of 1000 mg/kg/day', 'a NOAEL of 600 mg/kg/day was reported for Methylpropanediol and 1000 mg/kg /day werereported for Propanediol and Hexanediol (in females; 400 mg/kg/day', 'effects were observed (dosing on days 6-15 of gestation). A 100 mg/kg /day and a LOAEL of 300 mg/kg/day 1,4-Buta-nediol were reported', 'no parental re- productive parameters were changed by treatment. A 1000 mg/kg /day Hexanediol (dosing on days 6-19 of gestation) and Methylpropanediol', 'maternaland developmental effects in rats. In another oral exposurestudy, the 150 mg/kg /dayButyl Ethyl Propanediol in rats (dosing on days 6-19 ofgestation);', 'reduced food consumption and body weights in the dams. The 1000 mg / kg/day Butyl Ethyl Propanediol in this study. Genotoxicity experiments']",https://cir-reports.cir-safety.org/view-attachment/?id=94742a1a-c561-614f-9f89-14ce58abfc0b
"1,2,4-Trihydroxybenzene","['50 mg/kg', '50 mg/kg', '0.03577 mg/kg', '50 mg/kg']","['the intermediate dose group. The no-observed -adverse -effect -level ( 50 mg/kg bw/d. However, the SCCP concluded that no NOAEL could be', 'be 50 mg/kg bw/d. However, the SCCP concluded that no 50 mg/kg bw/d male rats . 2,4 This increase continued in a', 'an assessment factor of 3 for extrapolation from LOAEL to 0.03577 mg/kg bw (skin area surface of 580 cm2 x absorption through', '90- d gavage study of 1,2,4 -Trihydroxybenzene in rats, the 50 mg/kg bw/d, according to the researchers; this value was determined to']",https://cir-reports.cir-safety.org/view-attachment/?id=a1152e70-abec-b78c-b63e-a52bba62a429
"1,2-Butanediol","['300 mg/kg', '200 mg/kg', '100 mg/kg', '1000 mg/kg', '1000 mg/kg', '300 mg/kg', '100 mg/kg', '200 mg/kg', '1000 mg/kg']","['50 mg/kg/d, and a no observed adverse effect level ( 300 mg/kg /d for systemic toxi- city. The NOAEL was based on', '200 mg/kg/d (females). The no observable adverse effect level ( 200 mg/kg body weight/day in this study.35 According to a summary of', 'treatment period was largely reversible. Both the NOEL and the 100 mg/kg body weight/d.36 Pentylene glycol. Pentylene glycol was administered orally to', 'lactation) nor developmental toxicity effects on offspring were observed. The 1000 mg/kg for parental animals and the F 1generation.35The estimated dose of', 'for this study was calculated as 10 mg/kg/d, using an 1000 mg/kg /d and a reproductive toxicity uncertainty factor of 100.7158S International', 'overt toxic effects. An NOEL of 50 mg/kg/d and an 300 mg/kg /d for systemic toxicity in rats were reported in a', 'oral toxicity study on >98 %caprylyl glycol (Dermosoft Octiol). The 100 mg/kg /d was reported for rats in a 28-day oral toxicity', '(SymClariol). Short-term oral administration of 1,2-butanediol to rats yielded an 200 mg/kg /d. Reportedly, in another repeated dose study, the administration of', 'mouse local lymph node assay for evaluating sensitization potential. An 1000 mg/kg for reproductive/developmental toxicity has been reported for 1,2-butanediol in rats']",https://cir-reports.cir-safety.org/view-attachment/?id=9862ac6b-8e74-ec11-8943-0022482f06a6
"1,2-Hexanediol","['300 mg/kg', '200 mg/kg', '100 mg/kg', '1000 mg/kg', '1000 mg/kg', '300 mg/kg', '100 mg/kg', '200 mg/kg', '1000 mg/kg']","['50 mg/kg/d, and a no observed adverse effect level ( 300 mg/kg /d for systemic toxi- city. The NOAEL was based on', '200 mg/kg/d (females). The no observable adverse effect level ( 200 mg/kg body weight/day in this study.35 According to a summary of', 'treatment period was largely reversible. Both the NOEL and the 100 mg/kg body weight/d.36 Pentylene glycol. Pentylene glycol was administered orally to', 'lactation) nor developmental toxicity effects on offspring were observed. The 1000 mg/kg for parental animals and the F 1generation.35The estimated dose of', 'for this study was calculated as 10 mg/kg/d, using an 1000 mg/kg /d and a reproductive toxicity uncertainty factor of 100.7158S International', 'overt toxic effects. An NOEL of 50 mg/kg/d and an 300 mg/kg /d for systemic toxicity in rats were reported in a', 'oral toxicity study on >98 %caprylyl glycol (Dermosoft Octiol). The 100 mg/kg /d was reported for rats in a 28-day oral toxicity', '(SymClariol). Short-term oral administration of 1,2-butanediol to rats yielded an 200 mg/kg /d. Reportedly, in another repeated dose study, the administration of', 'mouse local lymph node assay for evaluating sensitization potential. An 1000 mg/kg for reproductive/developmental toxicity has been reported for 1,2-butanediol in rats']",https://cir-reports.cir-safety.org/view-attachment/?id=9862ac6b-8e74-ec11-8943-0022482f06a6
"1,4-Butanediol","['200 mg/kg', '400 mg/kg', '1000 mg/kg', '1000 mg/kg', '15 mg/kg', '150 mg/kg', '200 mg/kg', '1000 mg/kg', '400 mg/kg', '150 mg/kg', '23 mg/kg', '1000 mg/kg', '100 mg/kg', '1000 mg/kg', '400 mg', '1000 mg/kg', '1000 mg/kg', '1000 mg/kg', '1000 mg/kg', '1000 mg/kg', '1000 mg', '100 mg/kg', '1000 mg/kg', '150 mg/kg', '1000 mg/kg', '150 mg/kg', '1000 mg/kg', '200 mg/kg', '15 mg/kg', '600 mg/kg', '1000 mg/kg', '100 mg/kg', '1000 mg/kg', '150 mg/kg', '1000 mg']","['clinical chemistry samples were collected at study termination; necropsy performed 200 mg/kg /day for males and females; dose dependent toxic central nervous', 'by gavage as indicated; blood and urine samples were collected 400 mg/kg /day (males) and NOAEL of 1000 mg/kg/ day (females); no', 'and urine samples were collectedNOAEL of 400 mg/kg/day (males) and 1000 mg/kg / day (females); no mortality; treatment-related decrease with1000 mg/kg/day (males', 'daily by gavage as indicated; blood samples collected; necropsy performed 1000 mg/kg /day (males and females); NOEL of 15 mg/kg/day (males and', 'by gavage as indicated;blood and urine samples collected; necropsy performed 15 mg/kg /day (males) and NOAEL of 150 mg/kg/day (females); treatment-related deaths', 'urine samples collected; necropsy performedNOAEL of 15 mg/kg/day (males) and 150 mg/kg /day (females); treatment-related deaths of 3 males (1000 mg/kg/day) and', 'animals), and bladder abnormalities (400 and 800 mg/kg/day); a no-observed-adverse-effect-level( 200 mg/kg /day was reported. 13The results of testing Hexanediol in rats', 'a y sw e r ereported to be unremarkable. 20A 1000 mg/kg / day was reported for Butyl Ethyl Propanediol in a', 'at 10 mL/ kg and 2 deaths at 5 mL/kg.12 400 mg/kg /day (males) and 1000 mg/kg/day(females); a treatment-relate d decrease (in', 'were decreased liver enzymes and inorganic phosphate (at 1000 mg/kg/day).20 150 mg/kg /day (females) and 15 mg/kg/day(males) were reported for Butyl Ethyl', 'time) evaluating 1 ,4-Butanediol, a NOAEC of 500 mg/L (or 23 mg/kg /day) and a lowest-observed-adverse-effect-concentration (LOAEC) of 1500 mg/L (or lowest-observed-ad', 'on days 6 through 15 of gestationMaternal and fetal toxicity 1000 mg/kg /day; no maternal toxiceffects from treatment (fertility rate was 91%', 'gavage during days 6 through 15 of gestationMaternal and developmental 100 mg/kg /day; maternal anddevelopmental LOAEL of 300 mg/kg/ day ; no', 'day 4;animals killed at study conclusion and necropsy performedParental (female) 1000 mg/kg / day; parental (male) NOAEL of 400 mg/ kg/day; offspring', 'necropsy performedParental (female) NOAEL of 1000 mg/kg/ day; parental (male) 400 mg / kg/day; offspring (male/female) NOAELof 1000 mg/kg/day; male parents (1000', 'day; parental (male) NOAEL of 400 mg/ kg/day; offspring (male/female) 1000 mg/kg /day; male parents (1000 mg/kg/day) showed treatment-related (stat. sig) decrease', 'of gestation females were killed and necropsies performedMaternal and developmental 1000 mg/kg /day; no maternal mortalities or clinical signs; maternal body weight', 'at studytermination uterus, ovaries, and offspring were examinedMaternal and developmental 1000 mg/kg /day; no maternal toxic or embryotoxic effects were observed15 Methylpropanediol', 'were dosed by gavage (no further details provided)Maternal and neonatal 1000 mg/kg /day115 Methylpropanediol Rat, Wistar Females Up to 1000 mg/kg, negative', 'of gestation (no furtherdetails provided)Maternal toxicity, fetotoxicity, and teratogenic effects 1000 mg/kg /day; intrauterine growth and survival was not affected by treatment,', 'of gestation) or fetal toxiceffects were observed (maternal and fetal 1000 mg / kg/day). 12In a mouse study evaluating 1,4-Butanediol at up', 'on days 6 - 15 of gestation), amaternal and developmental 100 mg/kg /dayand a LOAEL of 300 mg/kg/day were reported; maternalcentral nervous', 'parental reproductive parameters were changed bytreatment. 13,22A maternal and developmental 1000 mg/kg /day was reported in animal studies on Hex- anediol (rats', '1000 mg/kg/day on days 6 - 19 ofgestation), a maternal 150 mg/kg /day (reducedactivity, staggering, limb dragging, slow respiration, andreduced food consumption/', 'consumption/ body weight at 1000 mg/kg dose) and a developmental 1000 mg/kg /day were reported. 17 Genotoxicity Provided below is a summary', 'gestation; animals were killed on gestation day 20; necropsy performedMaternal 150 mg/kg /day; Developmental NOAEL of 1000 mg/kg/ day; maternal clinical signs', 'gestation day 20; necropsy performedMaternal NOAEL of 150 mg/kg/day; Developmental 1000 mg/kg / day; maternal clinical signs included subdued behavior, reduced activity,', 'for Methylpropanediol.122S International Journal of Toxicology 43(Supplement 2)Reported NOELs and 200 mg/kg /day 1,4-Butanediol(∼42 days), 500 mg/kg/day 1,4-Butanediol in females and 50', '5.2 mg/L only); a 1.1 mg/L NOAEC was reported. The 15 mg/kg /day and 150 mg/kg/day Butyl Ethyl Pro-panediol (90 days) in', 'male and female rats, respectively. In 90- day studies, a 600 mg/kg /day was reported for Methylpropanediol and NOAELs of 1000 mg/kg/day', 'a NOAEL of 600 mg/kg/day was reported for Methylpropanediol and 1000 mg/kg /day werereported for Propanediol and Hexanediol (in females; 400 mg/kg/day', 'effects were observed (dosing on days 6-15 of gestation). A 100 mg/kg /day and a LOAEL of 300 mg/kg/day 1,4-Buta-nediol were reported', 'no parental re- productive parameters were changed by treatment. A 1000 mg/kg /day Hexanediol (dosing on days 6-19 of gestation) and Methylpropanediol', 'maternaland developmental effects in rats. In another oral exposurestudy, the 150 mg/kg /dayButyl Ethyl Propanediol in rats (dosing on days 6-19 ofgestation);', 'reduced food consumption and body weights in the dams. The 1000 mg / kg/day Butyl Ethyl Propanediol in this study. Genotoxicity experiments']",https://cir-reports.cir-safety.org/view-attachment/?id=94742a1a-c561-614f-9f89-14ce58abfc0b
"1,4-Butanediol/Succinic Acid/Adipic Acid/HDI Copolymer",[],[],https://cir-reports.cir-safety.org/view-attachment/?id=7154b0ad-8c74-ec11-8943-0022482f06a6
"1,5-Pentanediol","['200 mg/kg', '400 mg/kg', '1000 mg/kg', '1000 mg/kg', '15 mg/kg', '150 mg/kg', '200 mg/kg', '1000 mg/kg', '400 mg/kg', '150 mg/kg', '23 mg/kg', '1000 mg/kg', '100 mg/kg', '1000 mg/kg', '400 mg', '1000 mg/kg', '1000 mg/kg', '1000 mg/kg', '1000 mg/kg', '1000 mg/kg', '1000 mg', '100 mg/kg', '1000 mg/kg', '150 mg/kg', '1000 mg/kg', '150 mg/kg', '1000 mg/kg', '200 mg/kg', '15 mg/kg', '600 mg/kg', '1000 mg/kg', '100 mg/kg', '1000 mg/kg', '150 mg/kg', '1000 mg']","['clinical chemistry samples were collected at study termination; necropsy performed 200 mg/kg /day for males and females; dose dependent toxic central nervous', 'by gavage as indicated; blood and urine samples were collected 400 mg/kg /day (males) and NOAEL of 1000 mg/kg/ day (females); no', 'and urine samples were collectedNOAEL of 400 mg/kg/day (males) and 1000 mg/kg / day (females); no mortality; treatment-related decrease with1000 mg/kg/day (males', 'daily by gavage as indicated; blood samples collected; necropsy performed 1000 mg/kg /day (males and females); NOEL of 15 mg/kg/day (males and', 'by gavage as indicated;blood and urine samples collected; necropsy performed 15 mg/kg /day (males) and NOAEL of 150 mg/kg/day (females); treatment-related deaths', 'urine samples collected; necropsy performedNOAEL of 15 mg/kg/day (males) and 150 mg/kg /day (females); treatment-related deaths of 3 males (1000 mg/kg/day) and', 'animals), and bladder abnormalities (400 and 800 mg/kg/day); a no-observed-adverse-effect-level( 200 mg/kg /day was reported. 13The results of testing Hexanediol in rats', 'a y sw e r ereported to be unremarkable. 20A 1000 mg/kg / day was reported for Butyl Ethyl Propanediol in a', 'at 10 mL/ kg and 2 deaths at 5 mL/kg.12 400 mg/kg /day (males) and 1000 mg/kg/day(females); a treatment-relate d decrease (in', 'were decreased liver enzymes and inorganic phosphate (at 1000 mg/kg/day).20 150 mg/kg /day (females) and 15 mg/kg/day(males) were reported for Butyl Ethyl', 'time) evaluating 1 ,4-Butanediol, a NOAEC of 500 mg/L (or 23 mg/kg /day) and a lowest-observed-adverse-effect-concentration (LOAEC) of 1500 mg/L (or lowest-observed-ad', 'on days 6 through 15 of gestationMaternal and fetal toxicity 1000 mg/kg /day; no maternal toxiceffects from treatment (fertility rate was 91%', 'gavage during days 6 through 15 of gestationMaternal and developmental 100 mg/kg /day; maternal anddevelopmental LOAEL of 300 mg/kg/ day ; no', 'day 4;animals killed at study conclusion and necropsy performedParental (female) 1000 mg/kg / day; parental (male) NOAEL of 400 mg/ kg/day; offspring', 'necropsy performedParental (female) NOAEL of 1000 mg/kg/ day; parental (male) 400 mg / kg/day; offspring (male/female) NOAELof 1000 mg/kg/day; male parents (1000', 'day; parental (male) NOAEL of 400 mg/ kg/day; offspring (male/female) 1000 mg/kg /day; male parents (1000 mg/kg/day) showed treatment-related (stat. sig) decrease', 'of gestation females were killed and necropsies performedMaternal and developmental 1000 mg/kg /day; no maternal mortalities or clinical signs; maternal body weight', 'at studytermination uterus, ovaries, and offspring were examinedMaternal and developmental 1000 mg/kg /day; no maternal toxic or embryotoxic effects were observed15 Methylpropanediol', 'were dosed by gavage (no further details provided)Maternal and neonatal 1000 mg/kg /day115 Methylpropanediol Rat, Wistar Females Up to 1000 mg/kg, negative', 'of gestation (no furtherdetails provided)Maternal toxicity, fetotoxicity, and teratogenic effects 1000 mg/kg /day; intrauterine growth and survival was not affected by treatment,', 'of gestation) or fetal toxiceffects were observed (maternal and fetal 1000 mg / kg/day). 12In a mouse study evaluating 1,4-Butanediol at up', 'on days 6 - 15 of gestation), amaternal and developmental 100 mg/kg /dayand a LOAEL of 300 mg/kg/day were reported; maternalcentral nervous', 'parental reproductive parameters were changed bytreatment. 13,22A maternal and developmental 1000 mg/kg /day was reported in animal studies on Hex- anediol (rats', '1000 mg/kg/day on days 6 - 19 ofgestation), a maternal 150 mg/kg /day (reducedactivity, staggering, limb dragging, slow respiration, andreduced food consumption/', 'consumption/ body weight at 1000 mg/kg dose) and a developmental 1000 mg/kg /day were reported. 17 Genotoxicity Provided below is a summary', 'gestation; animals were killed on gestation day 20; necropsy performedMaternal 150 mg/kg /day; Developmental NOAEL of 1000 mg/kg/ day; maternal clinical signs', 'gestation day 20; necropsy performedMaternal NOAEL of 150 mg/kg/day; Developmental 1000 mg/kg / day; maternal clinical signs included subdued behavior, reduced activity,', 'for Methylpropanediol.122S International Journal of Toxicology 43(Supplement 2)Reported NOELs and 200 mg/kg /day 1,4-Butanediol(∼42 days), 500 mg/kg/day 1,4-Butanediol in females and 50', '5.2 mg/L only); a 1.1 mg/L NOAEC was reported. The 15 mg/kg /day and 150 mg/kg/day Butyl Ethyl Pro-panediol (90 days) in', 'male and female rats, respectively. In 90- day studies, a 600 mg/kg /day was reported for Methylpropanediol and NOAELs of 1000 mg/kg/day', 'a NOAEL of 600 mg/kg/day was reported for Methylpropanediol and 1000 mg/kg /day werereported for Propanediol and Hexanediol (in females; 400 mg/kg/day', 'effects were observed (dosing on days 6-15 of gestation). A 100 mg/kg /day and a LOAEL of 300 mg/kg/day 1,4-Buta-nediol were reported', 'no parental re- productive parameters were changed by treatment. A 1000 mg/kg /day Hexanediol (dosing on days 6-19 of gestation) and Methylpropanediol', 'maternaland developmental effects in rats. In another oral exposurestudy, the 150 mg/kg /dayButyl Ethyl Propanediol in rats (dosing on days 6-19 ofgestation);', 'reduced food consumption and body weights in the dams. The 1000 mg / kg/day Butyl Ethyl Propanediol in this study. Genotoxicity experiments']",https://cir-reports.cir-safety.org/view-attachment/?id=94742a1a-c561-614f-9f89-14ce58abfc0b
10-Hydroxydecanoic Acid,"['1000 mg/kg', '100 mg/kg', '1000 mg/kg', '50 mg/kg', '1000 mg/kg', '100 mg/kg', '50 mg/kg', '1000 mg/kg', '100 mg/kg', '1000 mg/kg', '2000 mg/kg', '1000 mg/kg', '1000 mg/kg', '1000 mg/kg', '50 mg/kg', '60 mg/kg', '1000 mg/kg', '1000 mg/kg', '1000 mg/kg', '200 mg/kg', '1500 mg/kg', '1000 mg/kg', '150 mg/kg', '150 mg/kg', '450 mg/kg']","['in Table 12. The no -observable -adverse effect level ( 1000 mg/kg bw/day for systemic effects, but the NOAEL for local effects', 'was > 1000 mg/kg bw/day for systemic effects, but the 100 mg/kg bw/day.28 The NOAEL s for Behenic Acid (up to 1000', 'the NOAEL for local effects was 100 mg/kg bw/day.28 The 1000 mg/kg bw/day) , Calcium Stearate (up to 2000 mg/kg bw/day) ,', 'oral studies.22,23,35 In oral gavage studies with Sodium Undecylenate, the 50 mg/kg bw/day with adverse effects including dose -dependent clinical signs of', 'fatty acid salt ingredients were above the doses tested. The 1000 mg/kg bw/day for systemic effects, but the NOAEL for local effects', 'was > 1000 mg/kg bw/day for systemic effects, but the 100 mg/kg bw/day . The NOAEL s for Behenic Acid, Calcium Stearate,', 'NOAEL for local effects was 100 mg/kg bw/day . The 50 mg/kg bw/day with adverse effects including dose -dependent clinical signs of', 'day 19 test sites washed with distilled water after exposure 1000 mg/kg bw/day in paternal animals for systemic effects ; NOAEL =', '1000 mg/kg bw/day in paternal animals for systemic effects ; 100 mg/kg bw/day for local effects; treatment -related increased incidence and/or severity', '14 days prior to mating to day 3 of lactation 1000 mg/kg bw/day; no treatment -related advers e effects observed 22 Calcium', 'the low - and mid-dose groups 28 day gavage study 2000 mg/kg bw/day; no unscheduled deaths; no significant toxicological changes any test', 'day g avage study in accordance with OECD TG 407 1000 mg/kg bw/day; slight to moderate breathing difficulties in several high dose', '28 day gavage study in accordance with OECD TG 407 1000 mg/kg bw/day; no treatment -related effects were obser ved, including in', '14 days prior to mating to day 3 of lactation 1000 mg/kg bw/day; no treatment -related adverse effects observed 23 Isomerized Safflower', 'with OECD TG 407; animals were treated for 14 days 50 mg/kg bw/day; treatment -related mortality observed in high dose group; dose-dependent', 'with OECD TG 408; animals were treated for 90 days 60 mg/kg bw/day; LOAEL = 180 mg/kg bw/day; clinical signs of toxicity', 'for 14 days prior to mating to gestation day 19 1000 mg/kg bw/day; no treatment -related adverse reproductive effects in parental animals', '14 days prior to mating to day 3 of lactation 1000 mg/kg bw/day; no treatment -related adverse effects observed in parental animals', '14 days prior to mating to day 3 of lactation 1000 mg/kg bw/day for parental animals and for offspring; no treatment -related', 'in accordance with OECD TG 421 (male rats were Maternal 200 mg/kg bw/day and fetal NOAEL > 2000 23 Table 13. DART', 'test material on gestation days 6 to15 Maternal and fetal 1500 mg/kg bw/day; no treatment - related adverse effects observed in parental', 'material on gestation days 6 to 15 Maternal and fetal 1000 mg/kg bw/day; no treatment- related adverse effects observed in parental animals', 'during mating, pregnancy, and lactation until day 4 post -partum 150 mg/kg bw/day for parental toxicity; NOEL = 450 mg/kg bw/day for', 'test material from day 6 to day of gestation Maternal 150 mg/kg bw/day and maternal LOAEL = 450 mg/kg bw/day; fetal NOAEL', 'mg/kg bw/day and maternal LOAEL = 450 mg/kg bw/day; fetal 450 mg/kg bw/day; high dose group treatment was terminated due to high']",https://cir-reports.cir-safety.org/view-attachment/?id=3a3ac6dd-8c74-ec11-8943-0022482f06a6
